Title,Link,Description,Tags
Coconut Palm Insurance Scheme,https://www.myscheme.gov.in/schemes/cpis,"The “Coconut Palm Insurance Scheme (CPIS)” is being implemented by the Coconut Development Board, Ministry of Agriculture and Farmers Welfare, Government of India with the objective of insuring coconut palms against natural calamities, climatic risks, pests, diseases, and other perils.","Coconut, Palm, Insurance, Farmer, Coconut Grower"
Direct Finance Scheme by NSFDC (GSCDC),https://www.myscheme.gov.in/schemes/dfsbnsfdc,"Under this scheme, loans are offered at a low interest rate, ranging from 1% to 5%, specifically for self-employment to scheduled caste (SC) individuals.","Self-employment, Scheduled Caste, Loan, Unemployed, Interest Rate"
Direct Finance Scheme by NSFDC (GSCDC),https://www.myscheme.gov.in/schemes/dfsbnsfdc,"Under this scheme, loans are offered at a low interest rate, ranging from 1% to 5%, specifically for self-employment to scheduled caste (SC) individuals.","Self-employment, Scheduled Caste, Loan, Unemployed, Interest Rate"
Direct Lending Scheme,https://www.myscheme.gov.in/schemes/dls-punjab,"Through the ""Direct Lending Scheme"", the Punjab Scheduled Castes Land Development & Finance Corporation (PSCLDFC) provides direct loans for the economic upliftment of the members of the Scheduled Castes and Handicapped People in the state of Punjab.","Loan, Scheduled Caste, Person With Disability, Banking, Social Welfare"
"District Central Cooperative Banks and through its Branches: For Consumer Durables T.V., Fridge and Two Wheelers Loan",https://www.myscheme.gov.in/schemes/dccbfcd,"A loan scheme provided by District Central Cooperative Banks for purchasing consumer durables like T.V., fridges, and two-wheelers. Loan covers 75% of the product cost at an interest rate of 14%.","Consumer Loan, Electronics, Two Wheeler Loan"
"District Central Cooperative Banks and through its Branches: For Professional Loan to Doctors, Engineers and Self Employed Professional",https://www.myscheme.gov.in/schemes/dccbfpl,"This scheme provides professional loans to doctors, engineers, and self-employed professionals through District Central Cooperative Banks. The maximum loan amount is ₹10,00,000 at an interest rate of 13% (subject to change).","Professional Loan, Doctors, Engineers, Self Employed Professional, Social Empowerment"
Intensive Fisheries Development Programme - Subsidy on Insurance Premium for Shrimp Crop Insurance,https://www.myscheme.gov.in/schemes/soipfsci,"The scheme aims to promote sustainable aquaculture by reducing financial risk of shrimp farmers through subsidized insurance coverage.Under this scheme, a 50% subsidy is provided on insurance premium paid by eligible fish farmers for shrimp crop insurance, helping them mitigate potential crop losses","Subsidy, Farmer, Crop Insurance, Shrimp Crop, Insurance"
Interest Free Loan (CBOCWWB),https://www.myscheme.gov.in/schemes/iflcbocwwb,"Under this scheme, interest free loan shall be granted to the registered construction workers of the Board for the purchase of items like Fridge, Television/ LCD, Motor Cycle/Scooter, Cooler, Fan & Bicycle.","Interest Free, Loan, Construction Worker, Labour"
Interest Free Loan Scheme To Teachers For The Purchase Of Laptops,https://www.myscheme.gov.in/schemes/iflstpl,"The scheme aims to enhance the quality of teaching in schools in the State of Goa by equipping teachers with necessary Information Technology knowledge and skills. It offers an Interest Free Loan up to a maximum of ₹1,00,000/- for purchasing a Laptop to regular/permanent, full-time teachers.","Teacher, Laon, Laptop, School, Technology"
Interest Subvention Scheme For Housing Loan For Regular State Government Employee Under APUN GHAR,https://www.myscheme.gov.in/schemes/apun-ghar,"Apun Ghar is a new home loan scheme for Assam Government employees as per announcement made in the Budget Speech,2016-2017 under which home loans will be provided to the State Government employees at subsidized interest rates.","Loan, Insurance, Interest Subvention, State Government Employee"
International Cooperation Scheme- Market Development Assistance,https://www.myscheme.gov.in/schemes/ics-mda,"The scheme “International Cooperation Scheme” was launched by the MSME, Govt. of India with the aim to capacity build MSMEs for entering the export market by facilitating their participation in international exhibitions/fairs/conferences/seminars/buyer-seller meets abroad.","International, Cooperation, Market, Development, Industry, Enterpris, MSME"
Jai Johar (Old Age Pension) Scheme,https://www.myscheme.gov.in/schemes/jjoaps,"“Jai Johar (Old Age Pension)” is a Social Security Scheme by the Tribal Development Dept, Govt of West Bengal. The scheme is aimed at the ST residents of West Bengal of the age of 60 years and above. A monthly pension of ₹ 1,000/- is transferred to the individual bank account of the beneficiary.","Pension, Senior Citizen, Social Welfare, Financial Assistance, Scheduled Tribe"
Jan Samuh Bima Yojana,https://www.myscheme.gov.in/schemes/jsby,"The scheme aims to provide financial assistance to Sahariya families in the event of the death of the heads of the families. Under this scheme, a one-time financial assistance of ₹25,000/- is provided by the insurance company to the deceased's family to help reduce their economic burden.","Financial Assistance, Death, Swachh Project, Sahariya Community, Insurance"
Home Loan Interest Subsidy Scheme- Gujarat Labour Welfare Board,https://www.myscheme.gov.in/schemes/hliss-glwb,"Under the scheme, a 3% Interest Subsidy is provided to workers who are employed in the organized sector to buy their own house and get relief from interest deductions on loans taken from banks.","Home Loan, Interest, Subsidy, Organized Worker, Labour, Industrial Worker"
House Building Loan Scheme for Employees of Government of Goa,https://www.myscheme.gov.in/schemes/hblsegg,The scheme aims to assist government employees in achieving their dream of owning a house by providing financial support to erstwhile House Building Advance scheme beneficiaries whose loans were operative as on 15th May 2020. The scheme provides loan takeover facility through empanelled banks.,"Loan, Housing, Subsidy, Interest, Finance"
Incentive Scheme for Sericulture Reelers,https://www.myscheme.gov.in/schemes/isfsr,"The ""Incentive Scheme for Sericulture Reelers"" is aimed at improving the financial condition of minority communities involved in silk reeling and spinning. The corporation will provide loans to support working capital and basic infrastructure for silk spinners.","Laon, Minority Community, Subsidy, Financial Assitance"
Indira Gandhi National Disability Pension Scheme,https://www.myscheme.gov.in/schemes/igndps,A non-contributory pension scheme to provide social security to Divyangjans aged 18 and above who belong to a poor family (BPL) in society.,"Differently Abled, Pension, Below Poverty Line - BPL"
Indira Gandhi National Widow Pension Scheme,https://www.myscheme.gov.in/schemes/ignwps,A non-contributory pension scheme to provide social security to widows of poor family (BPL)  of the society.,"Widow, Pension, Below Poverty Line - BPL"
Incentives To Encourage Purchases From Local Suppliers Scheme,https://www.myscheme.gov.in/schemes/ieplss-goa,"The scheme aims to encourage consumption through local purchases and support the economies of ancillary units, local Micro, Small and Medium Enterprises, and traders. It provides a reimbursement of 2% (up to ₹5,00,000/- annually) on eligible local purchases to eligible manufacturing units in Goa.","Manufacturer, MSME, Enterprise, Horticulture, Subsidy, Incentive"
Indira Gandhi National Disability Pension Scheme - Sikkim,https://www.myscheme.gov.in/schemes/igndps-sikkim,"The scheme “Indira Gandhi National Disability Pension Scheme (IGNDPS)” was started by the Department of Women & Child Welfare, Govt. of Sikkim in 2014. Under this scheme, financial assistance is provided to differently-abled persons with severe or multiple disabilities of more than 80%.","Disability, Pension, Below Poverty Line, Direct Benefit Transfer"
Indira Gandhi National Old Age Pension Scheme - Sikkim,https://www.myscheme.gov.in/schemes/ignoaps-sikkim,"The scheme “Indira Gandhi National Old Age Pension Scheme (IGNOAPS)” was started by the Department of Women & Child Welfare, Govt. of Sikkim in 2014. Under this scheme, a pension is provided to elderly citizens above the age of 60 years belonging to the Below Poverty Line (BPL) category.","Old Age, Pension, Below Poverty Line, Direct Benefit Transfer"
Indira Gandhi National Vidhva Pension yojana,https://www.myscheme.gov.in/schemes/ignvpyrr,"In the Indira Gandhi National Vidhva Pension Yojana (IGNWPS), financial support is provided to the widows of the state of Rajasthan.","Pension, Women, Widow"
Indira Gandhi National Vrdhavastha Pension Yojana,https://www.myscheme.gov.in/schemes/ignvpyr,"In this scheme, pension is payable to persons below from BPL category families listed as per the norms of the Government of India.","Pension, Old Age, Financial Assistance, Empower"
Indira Gandhi National Widow Pension Scheme - Sikkim,https://www.myscheme.gov.in/schemes/ignwps-sikkim,"The scheme “Indira Gandhi National Widow Pension Scheme (IGNWPS)” by the Department of Women & Child Welfare, Govt. of Sikkim provides financial support is provided to the poor widows of the state of Sikkim. The beneficiary receives a monthly pension of ₹ 2000/- through DBT.","Widow, Pension, Women, Below Poverty Line, Direct Benefit Transfer"
Individual loaning scheme: Haryana Women Development Corporation,https://www.myscheme.gov.in/schemes/ilshrwcd,"The scheme aims to provide financial assistance to women for economically viable projects. Through this scheme, subsidies and loans are provided to eligible women for projects costing.","Women, Project, Subsidy, Loan"
Industrial Sector Scheme (HSFDC),https://www.myscheme.gov.in/schemes/isshsfdc,"Under this scheme, the Corporation provides loans/benefits to individuals from BPL families, whose annual family income does not exceed ₹1,80,000/-, in both rural & urban areas for various self-employment income-generating activities such as carpentry, leather and leather goods manufacturing, etc.","Industrial Sector, HSFDC, Loan, BPL, Scheduled Caste, Trade, Business, Self-Employment"
Insurance Scheme For Artisans Component of the Development of Handicrafts Scheme,https://www.myscheme.gov.in/schemes/isa,"Under the scheme ""Insurance Scheme For Artisans"", artisans are covered under Jana Shree Bima Yojana LIC or any other suitable policy. The premium amount, as stipulated in the insurance policy, is shared, with 50% from the Social Security Fund and the remaining 50% from the Government.","Insurance, Artisans, LIC, Death, Disability"
Goa Tribal's Employment Generation Programme Scheme,https://www.myscheme.gov.in/schemes/gtegp,"""Goa Tribal’s Employment Generation Programme Scheme"" provides a subsidy of 40% on the total loan amount i.e. 95% of the project cost. The scheme is for educated unemployed individuals in the 18 to 45 years age group who are members of the tribal communities of Goa.","Loan, Employment, Business, Entrepreneurship, Scheduled Tribe"
Goa Welfare / Pension Scheme For Seafarers,https://www.myscheme.gov.in/schemes/gwpss,"The scheme ""Goa Welfare / Pension Scheme for Seafarers"" by the Home Department, Government of Goa, provides financial assistance in the form of a Gross Pension of ₹ 2,500/- per month to the beneficiaries. The applicant should be a retired seaman. The age of the applicant should be 60 years or above.","Pension, Seafarer, Seaman, Financial Assistance, Social Welfare, Retirement, Senior Citizen"
Gopabandhu Sambadika Swasthya Bima Yojana,https://www.myscheme.gov.in/schemes/gssby,"The “Gopabandhu Sambadika Swasthya Bima Yojana” was launched by the Information & Public Relations Department, Govt. of Odisha. It is a health insurance scheme that covers the medical expenses of the journalists and their eligible family members.","Gopabandhu, Swasthya Bima, Health Insurance, Journalist, Treatment, Medical Expense"
Grant for the Purchase of Work Related Tools for the Construction Workers,https://www.myscheme.gov.in/schemes/gpwrtcw,"The scheme aims to provide financial assistance for purchasing work-related tools. Through this scheme, a grant is provided to eligible members of the Fund.","Labour, Grant, Work Tool, Construction Workers, Financial Assistance"
Foreign Study Loan,https://www.myscheme.gov.in/schemes/fsl,"The scheme aims to provide financial assistance to students from non-reserved categories for pursuing higher studies abroad in medical and post-graduation courses. It offers loans up to ₹15,00,000/- at 4% simple interest per annum to eligible students.","Education, Loan, Foreign, Student, University"
Fund of Funds for Startups,https://www.myscheme.gov.in/schemes/ffs,"Launched in January 2016 under Startup India, the Fund of Funds for Startups is managed by SIDBI. It supports DPIIT-recognized startups indirectly by investing in SEBI-registered AIFs, which must invest at least twice the FFS contribution.","DPIIT, Startup India, Startups, AIF, Equity"
Green Business Scheme,https://www.myscheme.gov.in/schemes/gbs,Green Business Scheme has been launched by the National Safai Karamcharis Finance and Development Corporation to provide financial assistance in the form of loans for activities that can tackle the impacts of climate change and also be income-generating.,"Income Generation, Coverage, Battery Electric Vehicle, Compressed Air Vehicle, Solar Energy Gadgets, Poly Houses, Loan"
Green Business Scheme - Haryana,https://www.myscheme.gov.in/schemes/gbshr,"Under this scheme, loans of up to ₹2.00 lakhs are provided to Scheduled Caste residents of Haryana for undertaking income-generating activities that help mitigate the greenhouse effect, such as e-rickshaws, compressed air vehicles, solar energy gadgets, polyhouses, and similar eco-friendly ventures.","E-rickshaw, Compressed Air Vehicle, Solar Energy Gadgets, Poly Houses, Loan, Green Business"
Group Accident Insurance Scheme under PMMSY: Accidental death or Permanent Total Disability Gujarat,https://www.myscheme.gov.in/schemes/gaisguj1,"The scheme aims to provide financial assistance to fishermen/fishermen's families in case of death or injury. Through this scheme, insurance coverage for death permanent partial disability is provided to eligible fishers.","Accident, Death, Disability, Fishermen"
Group Accident Insurance Scheme under PMMSY: Medical Treatment - Gujarat,https://www.myscheme.gov.in/schemes/gaisguj3,"The scheme aims to provide financial assistance to fishermen/fishermen's families in case of death or injury. Through this scheme, insurance coverage for Medical Treatment is provided to eligible fishers.","Accident, Fishermen, Medical Treatment, Insaurance, Injury"
Group Insurance Scheme for Powerloom Weavers,https://www.myscheme.gov.in/schemes/gispw,"The basic objective of this scheme is to provide insurance cover to the powerloom weavers in the case of natural death, accidental death as well as partial and permanent disability due to accident.","Insurance, Powerloom Weavers, LIC, Educational Grant"
Group Accident Insurance Scheme under PMMSY: Permanent Partial Disability Gujarat,https://www.myscheme.gov.in/schemes/gaisguj2,"The scheme aims to provide financial assistance to fishermen/fishermen's families in case of death or injury. Through this scheme, insurance coverage for Permanent Partial Disability is provided to eligible fishers.","Fishermen, Disability, Insaurance, Injury, Partial Disability"
Group Insurance for Differently Abled Person Government Employees,https://www.myscheme.gov.in/schemes/gidapge,"The scheme “Group Insurance for Differently Abled Person Government Employees"" was launched by the Department of Social Welfare, Government of Puducherry. In this scheme, in the case of death due to accident while in service the sum insured will be given to the family of the deceased employee.","Government, Employee, Insurance, Banking, Disability"
Group Personal Accident Insurance Scheme For Coir Workers,https://www.myscheme.gov.in/schemes/gpaiscw,A group insurance scheme by MoMSME for coir workers. The scheme provides insurance cover against accidental death and permanent disability of the insured member.,"Insurance, Financial Assistance, Person With Disability"
Guruji Student Credit Card (GSCC) Scheme,https://www.myscheme.gov.in/schemes/gsccs,"Under this scheme, a financial support initiative by the Jharkhand Government to help students pursue higher education without financial constraints. Under this scheme, eligible students can avail of education loans up to ₹15,00,000 at a subsidized 4% simple interest rate, with additional benefits.","Student, Loan, Higher Education, Interest Rate"
Jharkhand Rajya Patrakar Swasth Bima Yojna Niyamawali 2021,https://www.myscheme.gov.in/schemes/jrpsbyn2021,The Jharkhand Rajya Patrakar Swasth Bima Yojna Niyamawali 2021 is a health insurance scheme for accredited journalists in Jharkhand. It provides comprehensive health coverage to ensure financial security during medical emergencies.,"Financial Assistance, Journalist, Insurance Scheme, Health"
Jhota Buggi/Camel/Mule Cart Scheme (HSFDC),https://www.myscheme.gov.in/schemes/jbcmcshsfdc,"Under this scheme, the Corporation provides loans to individuals from Below Poverty Line (BPL) families, whose annual family income does not exceed ₹1,80,000/-, in both rural and urban areas for purchasing animal-driven carts such as Jhota Buggis, camel carts, and mule carts.","Jhota Buggi, Camel Cart, Mule Cart, HSFDC, BPL, Scheduled Caste, Loan"
Karma Veer Dadasaheb Gaikwad Sabalikaran & Swabhiman Yojana,https://www.myscheme.gov.in/schemes/kvdgssy,"The main objective of this scheme is to improve the financial condition of the scheduled castes and Nav-Buddhists who are landless workers and are from ""Below Poverty Line"". Only citizens who are permanent residents of Maharashtra are eligible. This scheme is 100% funded by the State Govt.","Loan, Subsidy, Below Poverty Line, Scheduled Caste, Financial Assistance"
Kera Suraksha Insurance Scheme,https://www.myscheme.gov.in/schemes/ksis,"The ‘Kera Suraksha Insurance Scheme’ is a comprehensive Group Personal Accident Insurance Scheme, implemented by Coconut Development Board in association with Public Insurance companies for Coconut Tree Climbers/Neera Technicians/Coconut Harvesters.","Coconut Tree Climber, Insurance, Neera Technician, Coconut Harvester"
Khadi Karigar Janashree Bima Yojana,https://www.myscheme.gov.in/schemes/kkjby,"A group insurance scheme by MoMSME for khadi artisans (spinners and weavers). The scheme provides insurance cover against normal death, accidental death and disability of the insured member.","Insurance, Entrepreneur, Business, Persons With Disability, Citizen Empowerment"
Financial Assistance for Purchase of Existing Assets,https://www.myscheme.gov.in/schemes/fapea,"The scheme aims to assist the units who are in existence for a minimum period of 2 years with good track record. The assistance is provided for purchase of existing land, building and machinery with prescribed residual life. The applications for this scheme are accepted online only.","Entrepreneur, Industry, Loan, Investment, Asset, Financial Assistance"
Financial Assistance for Purchase of Battery Operated Vehicles,https://www.myscheme.gov.in/schemes/fapbov,"The scheme aims to provide financial assistance to eligible residents of Puducherry for the purchase of Battery-Operated vehicles. The scheme provides financial support, including an investment subsidy of ₹80,000/- provided by the Ministry of New and Renewable Energy, Govt. of India.","Investment, Vehicle, Battery, Subsidy, Loan"
Financial Assistance for Setting Up of Cold Storage,https://www.myscheme.gov.in/schemes/fasucs,"The scheme aims to assist the Proprietary/Partnership Concerns, Public/Private Limited Companies, Co-operative Societies, Market Committees, Boards, and Agro Industries Corporations. The assistance is provided for setting up of Cold Storage facilities. The applications for this scheme are online.","Entrepreneur, Industry, Loan, Investment, Storage, Financial Assistance"
Financial Assistive Devices for Persons with Disabilities,https://www.myscheme.gov.in/schemes/fadpd,"The scheme is implemented by the Haryana Backward Classes & Economically Weaker Sections Kalyan Nigam. Under the scheme, loans of up to ₹5 lakhs are provided to persons with disabilities who are either employed in reputable organizations or have received confirmed appointment letters.","PwD, Assistive Devices, Loan, Disability"
Financial Loan for Training of Commercial Pilot,https://www.myscheme.gov.in/schemes/flftcp,"The scheme aims to support students from Socially and Educationally Backward Classes (SEBC) in obtaining Commercial Pilot License (CPL) training through financial assistance. Under this scheme, a loan of up to ₹25,00,000 is offered at a concessional interest rate of 4% per annum to the students.....","Loan, Training, Opportunity, Skill Development, Interest Rate, SEBC"
Fishermen Accident Relief Scheme,https://www.myscheme.gov.in/schemes/fars,"The ""Fishermen Accident Relief Scheme"" introduced by the Agriculture, Farmers Welfare and Cooperation Department, Gujarat, aims to support the families of Gujarat's active fishermen by offering monetary compensation in case of accidental fatalities.","Agriculture, Farmer, Insurance, Accidental Assistance"
Kisan Credit Card Scheme for Fisheries- Chief Minister Fishermen Prosperity Scheme,https://www.myscheme.gov.in/schemes/kccsf-cmfps,The scheme aims to provide short-term loans for fisheries. It offers zero-percent interest working capital to the fish farmers through cooperative banks.,"Credit Card, Loan, Fishermen, Fish Farmer"
Kisan Credit Card (Pashupalan),https://www.myscheme.gov.in/schemes/kccp,The scheme aims to provide short-term working capital loans for livestock activities by offering eligible livestock farmers interest-subsidized loans for operational purposes through banks.,"Loan, Livestock, Cooperative Society, Interest Rate, Farmer, Agriculture"
Kisan Vikas Patra Scheme,https://www.myscheme.gov.in/schemes/kvps,"‘Kisan Vikas Patra Scheme’ was relaunched in the year 2014 by the Department of Economic Affairs, Ministry Of Finance, Government of India in view of the popular demand and to revitalize Small Savings. The amount invested in Kisan Vikas Patra (KYP) doubles in 115 months at the present rate.","Kisan, Investment, Savings, Certificate"
LIDCOM Gattai Stall Scheme,https://www.myscheme.gov.in/schemes/lgss,"Being implemented by LIDCOM, Govt. of Maharashtra for the Roadsides Cobblers from the (Scheduled Caste) Charmakar Community, this scheme provides a 100% subsidy for the erection of a Tin Stall of Size 4’ x 5’ x 6.5’ costing ₹16367/- per stall and ₹500/- incidental charges.","Business, Subsidy, Entrepreneurship, Banking, Scheduled Caste"
LIDCOM Margin Money Loan Scheme,https://www.myscheme.gov.in/schemes/lmmls,"In this scheme, for a loan limit from ₹50,001 to ₹5,00,000/-, 20% of the Project cost loan as Seed Capital is paid by the Corporation @ 4% interest per annum. A maximum of ₹10,000/- will be paid as a subsidy by Corporation. A 5% amount of project cost will have to be contributed by the beneficiary.","Loan, Subsidy, Scheduled Caste, Banking"
LIDCOM 50% Subsidy Scheme,https://www.myscheme.gov.in/schemes/l50ss,"The ""50% Subsidy Scheme"" is a scheme by LIDCOM, Govt. of Maharashtra. In this scheme, 50% amount is being given as a subsidy on a maximum loan amount of ₹50,000/-. The subsidy is subject to the maximum limit of ₹10,000/-. The bank charge of interest is as per the existing rate.","Loan, Subsidy, Scheduled Caste, Banking"
LIDCOM Education Loan Scheme,https://www.myscheme.gov.in/schemes/lels,"The ""Education Loan Scheme"" is a scheme by the Leather Industries Development Corporation (LIDCOM), Govt. of Maharashtra. In this scheme, finance of upto ₹ 20,00,000 is provided for post graduate students in the 18-50 years age group from Charmakar Community for studies in India and in abroad.","Loan, Education, Student, Postgraduation, Scheduled Caste"
Ladli Beti Scheme,https://www.myscheme.gov.in/schemes/lbs,A social assistance scheme sponsored by the J&K Govt. for newborn girl children born on or after 01/04/2015. The objective is to arrest the declining female sex ratio. The scheme ensures that the girl child does not become a burden for the parent or guardian at the time of her marriage.,"Girl Child, Financial Assistance, Social Welfare"
Large Sized Multi Purpose Coop. Society For Interest Free Loan,https://www.myscheme.gov.in/schemes/lsmpcifl,"The scheme provides interest-free loans to citizens through a cooperative society. The maximum loan amount offered is ₹45,000/-, with zero interest charged.","Interest Free Loan, Cooperative Society, Financial Assistance"
Large Sized Multi Purpose Coop. Society: Jewel Loan (Interest Free),https://www.myscheme.gov.in/schemes/lsmpcjl,"The scheme offers citizens interest-free loans up to ₹1,00,000/- on jewels, helping them meet various financial needs without the burden of interest rates.","Interest Free Loan, Cooperative Society, Jewel Loan"
Large Sized Multi-Purpose Coop. Society: Medium Term Loan to Tribal Members,https://www.myscheme.gov.in/schemes/lsmpcltt,"The scheme offers medium-term loans of up to ₹60,000/- without interest to tribal members, enabling them to fulfill various financial needs.","Interest Free Loan, Cooperative Society, Medium Term Loan, Tribal Welfare"
