Title,Link,Description,Tags
Education Assistance - Folk Artist,https://www.myscheme.gov.in/schemes/eafa,"The ""Education Assistance - Folk Artist"" scheme was launched by the Art and Culture Department, Government of Tamil Nadu. The scheme provides financial assistance for the education of children of registered folk artistes.","Student, Financial Assistance, Artist"
"Exhibition of Books on Tiatr, Its Song and Music",https://www.myscheme.gov.in/schemes/ebtsm,"The scheme aims to help Roman Script Konkani writers and publishers who face difficulties in marketing their books related to Tiatr, its song and music, while promoting Tiatr culture among enthusiasts. The scheme provides bulk purchase of books at 80% of the fixed rate and organizes book exhibition.","Exhibition, Book, Song, Music, Culture"
District Level Sports School,https://www.myscheme.gov.in/schemes/dlssg,"The scheme ""District Level Sports School"" by the Sports, Youth and Cultural Activities Dept., Government of Gujarat, aims to identify and nurture sporting talent through scientifically designed training, education, and sports facilities in residential and non-residential schools across the state.","Sports, Young Athlete Training, School Sports Program"
Divisional Tripartite Competition,https://www.myscheme.gov.in/schemes/dtc,The scheme aims to promote theatrical arts and drama performances across Gujarat by organizing competitive events at divisional and state levels. Individual performers and theatre organizations receive cash prizes based on their performance rankings in state-level competitions.,"Drama, Competition, Artist, Theatre, Culture, Award"
Documentation of Tiatr through Research Work,https://www.myscheme.gov.in/schemes/dttrw,"The scheme aims to encourage research work in the field of Tiatr and facilitate writers to take up research work in different aspects of Tiatr, its Song & Music. Research work will be published in book form with remuneration provided to researchers.","Research, Documentation, Book, Writer, Academia, Music"
Documentation And Research Assistantship Scheme,https://www.myscheme.gov.in/schemes/daris,The scheme aims to encourage documentation and digitisation of valuable Tiatr-related materials to prevent their loss to posterity. It provides assistance and incentives to holders of such materials and pays honorarium to documentation assistants.,"Documentation, Digitisation, Assistantship, Artist, Culture, Honorarium, Manuscript"
Chief Ministergi Artistesinggi Tengbang (CMAT) - Scheme For Award To Distinguished Artistes,https://www.myscheme.gov.in/schemes/cmat-sada,"The scheme ""CMAT - Scheme for Award to Distinguished Artistes"" is a scheme by the Dept. of Art & Culture, Govt. of Manipur, to encourage and felicitate the artistes (in the field of culture) belonging to different fields for their achievements such as winning National Awards namely Padma Award, etc.","Artist, Award, Financial Assistance"
Chief Ministergi Artistesinggi Tengbang (CMAT) – Artiste’s Pension,https://www.myscheme.gov.in/schemes/cmat-ap,"The scheme ""Chief Ministergi Artistesinggi Tengbang (CMAT) – Artiste’s Pension"" by the Dept. of Art and Culture, Govt. of Manipur provides a monthly pension of up to ₹ 4,000/- to the aged reputed artists who have contributed to making the tradition, culture, and art forms of Manipur more vibrant.","Artist, Pension, Financial Assistance, Manipur, Culture"
Chief Ministergi Artistessingi Tengbang - Assistance To The Cultural Group For Training With New Production,https://www.myscheme.gov.in/schemes/cmst-acgtnp,"""CMAT - Assistance to the Cultural Group for Training with New Production"" by the Dept. of Art and Culture, Govt. of Manipur aims at providing financial assistance to registered cultural groups that have been relentlessly working on providing training to the younger generation with new products.","Artist, Training, Workshop"
Chief Ministergi Artistesinggi Tengbang (CMAT) – Scheme Of Festival Assistance For Participating In International & National Festival,https://www.myscheme.gov.in/schemes/cmst-sfapinf,"Through the scheme ""Chief Ministergi Artistesinggi Tengbang (CMAT)-Scheme of Festival Assistance for Participating in International & National Festival"", the artists will be extended a sum of financial assistance to meet their travel costs and journey costs to participate in International Festivals.","Culture, Artist, Financial Assistance"
Chief Ministergi Artistesinggi Tengbang (CMAT): Support For Purchase Of Instruments / Equipment,https://www.myscheme.gov.in/schemes/cmat-spie,"The scheme ""CMAT: Support for Purchase of Instruments / Equipment"" aims to support many talented students and budding artistes, who are economically well but in need of instruments/equipment for their learning and performance purpose to help them groom towards professionalism.","Artist, Financial Assistance, Culture, Student"
Children's Tiatr Competition,https://www.myscheme.gov.in/schemes/ctc-g,"The scheme aims to encourage the development of Tiatr by providing a platform for children aged up to 16 years to participate in traditional Konkani theatre productions. The scheme benefits Educational Institutions, Sports and Cultural Associations, and Individual Producers.","Student, Competition, Theatre, Culture, Artist, Award"
Commemoration of Jubilees/Birth Anniversaries of Tiatr Artistes of Yesteryears,https://www.myscheme.gov.in/schemes/cjbatay,"The scheme aims to commemorate the significant contributions of deceased Tiatr artistes, making the younger generation aware of their legacy. It provides financial assistance, publicity, and venue support for organizing cultural programmes celebrating jubilee/birth anniversaries of these pioneers.","Artist, Culture, Program, Financial Assistance, Stage, Music"
Internship Policy Of Indian Council For Cultural Relations (ICCR),https://www.myscheme.gov.in/schemes/ipiccr,"ICCR provides an excellent opportunity for budding scholars to familiarise themselves with the role of soft power in foreign policy formulation in the Govt of India. These ‘Interns’ would be expected to supplement the process of analysis in various fields (creative writing, cultural mapping, etc).","Internship, Student, Culture, Stipend, Honorarium"
International Financial Assistance,https://www.myscheme.gov.in/schemes/ifag,"The scheme ""International Financial Assistance"" by the Sports, Youth and Cultural Activities Department, aims to promote participation of Gujarat sportspersons in international competitions through financial support of ₹75,000/- for travel, accommodation, and other related expenses.","International Sports, Athlete, Air Travel Expenses"
Gaurav Puraskar Award,https://www.myscheme.gov.in/schemes/gpag,"The scheme ""Gaurav Puraskar Award"" by the Sports, Youth and Cultural Activities Department, Government of Gujarat, aims to honour artistes for their significant achievements in music, dance, drama, and folk art by providing a cash award, trophy, and appreciation letter.","Artist Recognition, Music, Dance, Drama"
Gen Next Competition,https://www.myscheme.gov.in/schemes/gnc,"The ""Gen Next Competition"" scheme was launched by the Department of Handlooms, Handicrafts, Textiles & Khadi, Govt. of Tamil Nadu. A craft competition was started from the year 2013-2014 to encourage the youth to retain the traditional handicrafts of Tamil Nadu & pass them on to the next generation.","Generation, Prize, Artisans, Youngsters, Handicraft"
Girnar Arohan-Avrohan Competition,https://www.myscheme.gov.in/schemes/gaac,"The scheme “Girnar Arohan-Avrohan Competition” by the Department of Sports, Youth and Cultural Activities aims to promote physical fitness and competitive spirit among citizens through a state-level stair-climbing competition on Mount Girnar, offering cash prizes to the top 10 winners.","Mount Girnar Competition, Stair Climbing Competition, Youth Activities"
Goa State Cultural Award for Institution,https://www.myscheme.gov.in/schemes/gscai,"The scheme ""Goa State Cultural Award for Institution"" by the Directorate of Art and Culture, Government of Goa is designed to recognize, promote and appreciate the contribution of the institution in the field of Art and culture. This will give a tremendous boost to cultural institutions in Goa.","Culture, Award, Institution, Financial Assistance, Artist"
Goa State Best Library and Best Librarian Award,https://www.myscheme.gov.in/schemes/gsblbla,"The scheme ""Goa State Best Library and Best Librarian Award"" has been designed to envisage grant of awards for one meritorious Library and one Librarian serving either in any Government or Government–aided Libraries in the State of Goa, which includes the Public/Academic/Special/Research Libraries.","Library, Librarian, Award, Culture"
Goa State Cultural Award,https://www.myscheme.gov.in/schemes/gsca,"""Goa State Cultural Award"" has been designed to honour the eminent personalities in the field of Art and culture. The scheme intends to give recognition to the Goan artists par excellence for their lifetime achievements and for their extraordinary contribution to the field of Art and culture in Goa.","Artist, Culture, Award, Lifetime Achievement, Music, Dance, Drama"
Gomant Vibhushan Award,https://www.myscheme.gov.in/schemes/gva,"The scheme ""Gomant Vibhushan Award"" has been designed in order to honour and recognize the Goan renowned personalities who have contributed to the distinguished and extraordinary achievements/ services in any field of activities/disciplines such as art & culture, literature & education, sports, etc.","Award, Culture, Artist, Literature, Philosophy"
Grant For Oru Kala Pooja,https://www.myscheme.gov.in/schemes/gokp,"The scheme aims to provide annual financial assistance to Hindu Religious Institutions situated in the Union Territory of Puducherry that have poor resources. It benefits the temple authorities by covering expenses associated with the performance of Oru Kala Pooja, Current Consumption Charges, etc.","Grant, Temple, Financial Assistance, Religion, Heritage"
Free Education For Sports Medal Winners / Participants Of National/ International Events,https://www.myscheme.gov.in/schemes/fesmwpnie,"The scheme of ""Free Education for Sports Medal Winners / Participants of National/ International Events"" is introduced by UGC, to provide financial assistance to the medal winners\ elite sports persons studying in universities/colleges leading to all the full-time regular courses.","Sports, Education"
Grant to Films,https://www.myscheme.gov.in/schemes/gfuk,"The policy aims to promote film production in Uttarakhand by providing financial grants to films, TV serials, and web series shot in the state, encouraging filmmakers to showcase Uttarakhand’s culture, heritage, and locations, and boosting local employment and the state's film economy.","Grant, Film, Film Producer, Film Policy"
Grant to Meritorious Wards of ESM in Sports: National / International Level (Sainik Welfare),https://www.myscheme.gov.in/schemes/gmwesnil-sw,"""Grant to Meritorious Wards of ESM in Sports: National / International Level"" is a Welfare Scheme by the Department of Sainik Welfare, Puducherry. The meritorious wards of the ESM are provided grants for their achievements in sports at national and international levels. The application is offline.","Sports, Student, Ex-Serviceman, Widow, Grant"
Haryana Provision of Sports Equipment Scheme,https://www.myscheme.gov.in/schemes/hposec,"""Haryana Provision of Sports Equipment Scheme"" by the Sports Dept, Government of Haryana provides sports equipment to Gram Panchayats and Municipal bodies to encourage youngsters in the state towards sports such as Volleyball, Football, Basketball, Handball, Boxing, Wrestling, Judo, Cricket, etc.","Equipment, Panchayat, Grant, Sports"
Jharkhand Sports Excellence Cash Award Scheme to Coaches,https://www.myscheme.gov.in/schemes/jsecasc,"The “Jharkhand Sports Excellence Cash Award Scheme to Coaches” aims to provide cash awards to coaches who train athletes and teams to achieve excellence in national and international competitions under the Jharkhand Sports Policy, 2022.","Financial Assistance, Award, Coaches, Athletes, National, International"
Jharkhand Sports Excellence Cash Award Scheme to Players,https://www.myscheme.gov.in/schemes/jsecasp,"The “Jharkhand Sports Excellence Cash Award Scheme to Players” aims to provide cash awards to athletes for exceptional achievements in national and international competitions, as per the Jharkhand Sports Policy, 2022.","Financial Assistance, Award, Sportsperson, Athletes"
Jharkhand Sportsperson Pension Scheme,https://www.myscheme.gov.in/schemes/jsps,"The “Jharkhand Sportsperson Pension Scheme” aims to provide financial support to retired athletes for their lifelong contribution to sports. Athletes, including Arjuna, Dronacharya, and Dhyan Chand awardees, Olympic participants, and Commonwealth or Asian Games medalists, receive a monthly pension.","Financial Assistance, Sportsperson, Pension"
Junior/Senior Fellowship in the Field of Fine Arts,https://www.myscheme.gov.in/schemes/jsifffa,"The scheme ""Junior/Senior Fellowship in the Field of Fine Arts"" by the Sports, Youth and Cultural Activities Department, Government of Gujarat, aims to support artistic innovation and research by offering fellowships to young and senior artists in Gujarat.","Fine Arts, Artist, Fellowship, Painting, Sculpture"
Kailash Darshan Yatra,https://www.myscheme.gov.in/schemes/kdy,"The scheme provides financial assistance to pilgrims from Gujarat undertaking the Kailash Darshan Yatra. To be eligible, the applicant must be a selected pilgrim from Gujarat and submit proof of yatra completion within 90 days. Applications for this scheme are accepted offline.","Travel, Tourism, Pilgrim, Culture, Heritage"
Kala Utsav Pratiyogita - Uttarakhand,https://www.myscheme.gov.in/schemes/kupuk,The scheme aims to promote and encourage artistic talent among school students of Classes 9 to 12.,"Art Festival, Competition, Samagra Shiksha, Students"
Kalakar Kritadnyata Nidhi: Compensation Towards Natural Calamities,https://www.myscheme.gov.in/schemes/kkn-ctnc,"The scheme aims to financially assist the Goan artists to meet expenses towards repair or construction of their houses damaged due to natural calamities. The maximum financial assistance provided under this component is ₹25,000/- or the valuation done by the Taluka Mamlatdar.","Artist, Culture, Compensation, Calamity, House, Construction"
Kalakar Kritadnyata Nidhi: Incentive for Self Employment,https://www.myscheme.gov.in/schemes/kkn-ifse,"The scheme aims to provide financial assistance not exceeding ₹50,000/- or the actual cost, whichever is less, to needy Goan artists or their families for setting up self-employment ventures, helping them establish sustainable income sources. The applications for this scheme are accepted Offline.","Artist, Employment, Entrepreneur, Livelihood, Income, Training"
Kalakar Kritadnyata Nidhi: Financial Assistance For Funeral of the Artist,https://www.myscheme.gov.in/schemes/kkn-faffota,"The scheme aims to provide financial relief to the families of deceased Goan artists by assisting them in meeting funeral expenses, thereby acknowledging the contributions of artists and supporting their families during difficult times. The component provides financial assistance of up to ₹10,000/-.","Death, Funeral, Artist, Relief, Family"
Kala Gaurav Puraskar,https://www.myscheme.gov.in/schemes/kgp-goa,"""Kala Gaurav Puraskar"" is presented to artists working in the field of Art and Culture who have given outstanding contributions in their respective fields of art. Such artists need to be felicitated and their substantial contribution needs to be felicitated.","Award, Art, Culture, Lifetime Achievement, Financial Assistance"
Kala Samman Scheme,https://www.myscheme.gov.in/schemes/kss,"The scheme ""Kala Samman Scheme"" grants financial assistance to eminent artists who are in indigent circumstances as a token of respect for their contribution to the field of Art and culture.","Artist, Culture, Art, Financial Assistance, Award"
Kalakar Kritadnyata Nidhi: Lumpsum Grant,https://www.myscheme.gov.in/schemes/kkn-lg,"The scheme aims to provide a lumpsum grant (maximum ₹20,000/-) to the dependent family in case of death of the artist. The one-time financial assistance amount is disbursed to the eligible applicant in the form of Electronic Clearing Service (ECS) mode. The applications are accepted offline.","Artist, Family, Death, Financial Assistance, Dependent"
Kalakar Kritadnyata Nidhi: Scholarships/Incentives,https://www.myscheme.gov.in/schemes/kkn-si,"The scheme aims to provide financial support to the wards of recognized Goan artists who are pursuing higher education, thereby addressing the economic challenges faced by artist families in supporting their children's educational aspirations and ensuring continuity of educational opportunities.","Artist, Scholarship, Student, Education, Culture"
Kalakar Kritadnyata Nidhi: Pandemics,https://www.myscheme.gov.in/schemes/kkn-p,"The scheme aims to provide financial assistance to aged and needy Goan artists who have lost the source of income due to the pandemic. The scheme provides relief in the form of financial assistance amounting to a min. of ₹5,000/- (lumpsum) up to a max. of ₹10,000/- (lumpsum) to eligible artists.","Artist, Pandemic, Relief, Financial Assistance, Culture"
Kalakar Kritadnyata Nidhi: Marriage Component,https://www.myscheme.gov.in/schemes/kkn-mc,"The scheme aims to provide financial assistance to aged and needy Goan artists. It offers marriage assistance of up to ₹20,000/- for the first daughter and ₹15,000/- for the second daughter of eligible artists.","Artist, Marriage, Daughter, Family, Culture"
Kalakar Kritadnyata Nidhi: Medical Treatment,https://www.myscheme.gov.in/schemes/kkn-mt,"The scheme aims to provide financial assistance to aged and needy Goan artists and their dependent family members for medical treatment expenses. It covers major or minor surgical treatment costs in local or outstation hospitals, including travelling and accommodation expenses.","Artist, Medical, Healthcare, Surgery, Subsidy, Hospital"
Kamban Pugazh Literary Prize,https://www.myscheme.gov.in/schemes/kplp,"The scheme ""Kamban Pugazh Literary Prize"" was launched by the Arts and Culture Department, Puducherry. The scheme aims to provide prizes of ₹10,000/- and 10 awards to the author in the field of novels, short stories, drama, poems & prose in Tamil.","Artist, Financial Assistance, Prize, Publication, Book"
Khel Mahakumbh,https://www.myscheme.gov.in/schemes/kmk,"The scheme ""Khel Mahakumbh"" by the Sports, Youth and Cultural Activities Department, Government of Gujarat aims to promote sports culture and identify grassroots talent through cash prizes and structured competitions, benefiting all individuals and students across Gujarat.","Sports, Cash Prize, Sports Talent, Competition"
Khel Chhatravriti (Vritika) Yojana,https://www.myscheme.gov.in/schemes/kcvy,"The ""Khel Chhatravriti (Vritika) Yojana"" implemented by the Directorate of Art, Culture, Sports, and Youth Affairs, Government of Jharkhand, provides financial assistance to athletes based on their performance to encourage sports as a career.","Financial Assistance, Sportsperson, Career, Scholarship"
Khel Pratibha Puraskar,https://www.myscheme.gov.in/schemes/kppg,"The scheme “Khel Pratibha Puraskar” by the Sports, Youth and Cultural Activities Department, Government of Gujarat aims to recognize and encourage sportspersons by providing cash prizes ranging from ₹10,000 to ₹5,00,00,000 to national and international medal winners across the state.","Sports Awards, Cash Prize, Athlete"
Khiladi Protsahan Chhatravriti Yojana,https://www.myscheme.gov.in/schemes/piss,"The scheme aims to promote sports among talented youth sportspersons aged 14 to 23 years from Uttarakhand by providing a scholarship of ₹2,000/- per month and financial assistance of ₹10,000/- once a year for sports equipment.","Sports, Sportsperson, Scholarship, Player"
Financial Assistance for Encouraging Worker's Children's Participation in Cultural Activities- Haryana Labour Welfare Board,https://www.myscheme.gov.in/schemes/faewcpca-hlwb,"Under this scheme, financial assistance is provided to the children of the workers working in the industrial and commercial establishments of the state of Haryana for participating in cultural competitions so that the children of the workers can also become good artists.","Financial Assistance, Worker, Participation In Cultural Activities, Artist, Cultural Competitions, Dance, Music"
"Financial Assistance for Preparation of Training Camp and Participation in Land, Mountain & Sea Adventure Sports Competitions",https://www.myscheme.gov.in/schemes/faptlmsc,"The scheme aims to promote youth participation in adventure sports by providing financial assistance for training, workshops, and competitions.","Adventure Sports, Financial Assistance, Youth Empowerment, Training Camps"
Financial Assistance for Scaling Mount Everest and Other Inaccessible Mountains of the World,https://www.myscheme.gov.in/schemes/fasmeimw,"The scheme ""Financial Assistance for Scaling Mount Everest and Other Inaccessible Mountains of the World"" aims to promote mountaineering by providing financial aid to successful climbers, including up to ₹15,00,000 for those who scale Mt. Everest.","Mountaineering, Everest Climbing, Adventure Sports"
Financial Assistance for encouraging production of Traditional Khell-Tiatr,https://www.myscheme.gov.in/schemes/faeptkt,"The scheme aims to encourage and preserve the traditional Khell-Tiatr folk musical drama of Goa by promoting quality productions. It offers financial assistance and infrastructure support for staging shows, including video documentation, benefiting dramatic troupes and individuals.","Culture, Artist, Stage, Performance, Drama, Financial Assistance"
Financial Assistance to Authors for Book Publication,https://www.myscheme.gov.in/schemes/fatafbp,"The scheme aims to support the state's eminent litterateurs, writers, poets, and authors by providing financial assistance whose literary works remain unpublished due to financial constraints.","Financial Assistance, Author, Book Publication, Writer, Poet, Litterateurs"
Financial Assistance to Dramatic Troupes participating in Kala Academy’s Annual Tiatr Competition,https://www.myscheme.gov.in/schemes/fadtpkaatc,"The scheme aims to encourage non-commercial dramatic troupes participating in Kala Academy’s Annual Tiatr Competition to produce higher quality Tiatrs. It provides financial support for various production aspects, video recording, and expert workshops, benefiting dramatic troupes.","Culture, Artist, Drama, Workshop, Financial Assistance, Music"
Financial Assistance to Commercial Tiatr Troupes/Directors/Producers for Stage Setting,https://www.myscheme.gov.in/schemes/facttdpss,"The scheme aims to encourage all round development of the Tiatr in all aspects by providing encouragement to commercial tiatr directors and producers to bring in development in stage setting, addressing the need for improved theatrical infrastructure and production quality.","Theatre, Director, Producer, Stage, Financial Assistance"
Financial Assistance to Former Sports Person of UP,https://www.myscheme.gov.in/schemes/fafspup,"The scheme “Financial Assistance to Former Sports Person of UP” was launched by the Department of Sports, Government of Uttar Pradesh to provide financial assistance to sports persons who are old, weak, or facing hardships, under a scheme for the welfare of sports person of the state.","Financial Assistance, Sports Person, Sports"
Financial Assistance to Indigent Artistes,https://www.myscheme.gov.in/schemes/fatia,"The scheme ""Financial Assistance to Indigent Artistes"" was launched by the Arts and Culture Department, Puducherry. The scheme aims to provide financial assistance of ₹1,000/- per month to indigent artists aged 50 years and above and contributions to music, dance, drama, folk, painting, sculpture.","Indigent, Artist, Financial Assistance, Culture"
Financial Assistance to Helpless Artists,https://www.myscheme.gov.in/schemes/fatha,"Under this scheme, monthly financial assistance is given to artists and their dependents who are physically disabled, over 60 years old, have a monthly income of less than ₹600, and are unable to sustain themselves due to age or disability.","Financial Assistance, Senior Citizen, Artist, Physically Disabled, PwD"
"Financial Assistance to Revive, Preserve and Protect Goan Maand Culture",https://www.myscheme.gov.in/schemes/farppgmc,"The scheme “Financial Assistance to Revive, Preserve and Protect Goan Maand Culture” by the Directorate of Art and Culture, Government of Goa has been designed with the objective of encouraging Goan Folk artists to revive, preserve and protect the Goan Maand culture consisting of folk forms.","Culture, Folk, Art, Music, Lore"
Financial Assistance to Troupes Going to Mumbai/Poona and Other Parts of the Country & Vice Versa,https://www.myscheme.gov.in/schemes/fatgmpopcvv,"The scheme aims to compensate Goan dramatic troupes for transportation expenses when staging Tiatrs in Mumbai, Poona, and other parts of India, and vice versa. It offers financial assistance to promote Goan Tiatr, benefiting directors and writers of Goan and Mumbai/Poona troupes.","Culture, Artist, Stage, Performance, Tour, Financial Assistance"
