Title,Link,Description,Tags
"Financial Assistance to Sportspersons to Pursue Sports Coaching Courses Conducted by SAI, NSNIS, Patiala as a Part of Skill Development Programme to Improve their Employability",https://www.myscheme.gov.in/schemes/faspscccsnppsdppie,"The Scheme was launched by the Department of Sports & Youth Services Department, Government of Odisha to provide financial assistance to sportspersons of Odisha to help them become qualified coaches, by undertaking SAI, NSNIS coaching courses, so as to improve their employability.","Financial Assistance, Sportsperson, Sports Coaching, SAI, NSNIS, Skill Development, BPL"
Financial Assistance to the Family of Temple Employees,https://www.myscheme.gov.in/schemes/fafte,"The scheme aims to grant financial assistance to the family of the temple employee who expires while in service. The scheme provides an amount of ₹5,000/- under the Group Insurance Scheme and an amount of ₹20,000/- under the Chief Minister’s Welfare Fund. The applications are accepted offline.","Employee, Death, Financial Assistance, Insurance, Temple, Welfare"
Financial Assistance/Pension to Former Renowned Sportspersons,https://www.myscheme.gov.in/schemes/fapfrs,"The scheme aims to provide lifelong monthly financial assistance ranging from ₹4,000/- to ₹10,000/- in the form of a pension to former renowned sportspersons of Uttarakhand who are above 50 years of age and are financially weak.","Pension, Games, Sports, Sportsperson"
Financial Grant for Sports Associations,https://www.myscheme.gov.in/schemes/fgfsa,"The scheme ""Financial Grant for Sports Associations"" implemented by the Tourism, Art-Culture, Sports, and Youth Affairs Department, Government of Jharkhand, provides financial assistance to recognized sports associations for organizing sports activities and promoting talent.","Financial Assistance, Sports, Associations"
Khiladi Protsahan Yojana,https://www.myscheme.gov.in/schemes/kpymp,"In 2017, the Madhya Pradesh Labour Department initiated the Khilaadee Protsaahan Yojana to provide financial assistance to players.","Sports, Financial Assistance, Labour, Social Welfare"
Konkani Song & Music Awards (Tiatr Kantaram),https://www.myscheme.gov.in/schemes/ksma-tk,"The scheme aims to encourage producers, lyricists, singers, and musicians to produce qualitative Konkani Audio/Video/Digital albums of Tiatr songs. Cash awards from ₹5,000/- to ₹30,000/- are provided across twelve categories to Goan artists producing Konkani kantaram albums.","Artist, Culture, Music, Award, Competition"
Late Jaswantsinhji Thakor and Late Rasiklal Andhariya Classical Music Scholarship,https://www.myscheme.gov.in/schemes/ljtlracms,"The scheme ""Late Jaswantsinhji Thakor and Late Rasiklal Andhariya Classical Music Scholarship"" by the Sports, Youth and Cultural Activities Department aims to promote classical music education by providing annual scholarships to eligible Gurus and their disciples across Gujarat.","Classical Music, Music Scholarship, Music"
Laxman Award / Rani Laxmi Bai Award Scheme,https://www.myscheme.gov.in/schemes/larlbas,"The scheme “Laxman Award/Rani Laxmi Bai Award” was launched by the Department of Sports, Government of Uttar Pradesh to honor special sports personalities of the state. The Laxman award is to male sportspersons and the Rani Laxmi Bai award is given to female sportspersons.","Financial Assistance, Sports, Sportsperson, Award"
Laxman Award / Rani Laxmi Bai Award Scheme- Differently-abled and Posthumously,https://www.myscheme.gov.in/schemes/larlbasdaap,"The scheme “Laxman Award/Rani Laxmi Bai Award” was launched by the Department of Sports, Government of Uttar Pradesh to honor special sports personalities of the state, differently-abled players and the Laxman Award, the highest sports award of the state will be given posthumously to Shahid.","Differently-abled, Sports, Sportsperson, Award, Posthumously"
Lifetime Contribution to Tiatr Awards (Commercial),https://www.myscheme.gov.in/schemes/lctac,"The scheme aims to recognize and honor tiatr artistes who have contributed immensely for the development of tiatr, its song and music in the past, addressing the need to acknowledge their lifetime dedication to this traditional art form. The scheme provides a comprehensive recognition package.","Culture, Artist, Award, Commercial, Theatre"
Lifetime Contribution to Khell/Khell-Tiatr Awards,https://www.myscheme.gov.in/schemes/lckkta,The scheme aims to recognize veteran Khell/Khell-Tiatr artistes who have made significant contributions to this traditional art form. It honors deserving artistes with lifetime achievement awards and cash burse.,"Artist, Award, Theatre, Culture, Heritage"
Lifetime Contribution to Konkani Cinema Award,https://www.myscheme.gov.in/schemes/lckca,"The scheme provides a prestigious annual award consisting of a shawl, memento, citation, and cash purse of ₹50,000/-, with recognition given at a special function held on 24th April every year on the anniversary of the release of the first Konkani film 'Mogacho Anvddo' by late Al-Jerry Braganza.","Artist, Cinema, Award, Culture, Heritage"
Lifetime Contribution to Tiatr Awards (Non-Commercial),https://www.myscheme.gov.in/schemes/lctanc,"The scheme recognizes and honors non-commercial artistes who have contributed immensely for the development of tiatr, its song and music through yearly Tiatr Festivals/Competitions organized by Kala Academy and by organizing tiatrs in villages, as well as artistes who have enriched Konkani Tiatr.","Award, Artist, Culture, Achievement, Heritage"
Living Craft Treasure Award,https://www.myscheme.gov.in/schemes/lcta,"The ""Living Craft Treasure Award"" scheme was launched by the Handlooms, Handicrafts, Textiles, and Khadi Department, Govt. of Tamil Nadu. This is the highest award for handicrafts at the state level was introduced in the year 2013-2014 to craftsperson of eminence who are above the age of 65 years.","Award, Artisans, Handicrafts, Financial Assistance, Senior Citizen"
Lokprasar Prakalpo Scheme,https://www.myscheme.gov.in/schemes/lps,"The scheme “Lokprasar Prakalpo Scheme” was launched by the Department of Information & Cultural Affairs, Government of West Bengal in 2014 to revive the Folk and Tribal Culture in their respective genre across various zones and districts in the State.","Folk, Artists, Tribal Culture, Pension, Financial Assistance, Performance Fee"
Madhya Pradesh Kalakar Evam Sahityakar Kalyan Kosh Niyam- Death Assistance,https://www.myscheme.gov.in/schemes/mpkskkn-da,The scheme aims to provide one-time financial assistance to the dependents of deceased artists and litterateurs.,"Financial Assistance, Artists, Litterateurs, Dependent, Death, Family"
Madhya Pradesh Kalakar Evam Sahityakar Kalyan Kosh Niyam- Disability Assistance,https://www.myscheme.gov.in/schemes/mpkskkn-d,The scheme aims to provide one-time financial assistance to physically disabled artists and litterateurs for disability-related medical treatment and rehabilitation.,"Financial Assistance, Disability, Artists, Litterateurs, Medical Treatment, Rehabilitation"
Madhya Pradesh Kalakar Evam Sahityakar Kalyan Kosh Niyam- Serious Illness / Accident / Calamity Assistance,https://www.myscheme.gov.in/schemes/mpkskkn-diancal,"The scheme aims to provide one-time financial assistance for serious illness, accident, or calamity-related medical treatment to artists and litterateurs.","Financial Assistance, Calamity, Illness, Accident, Artists, Litterateurs"
Madhya Pradesh Non-Government Institution Grant Scheme,https://www.myscheme.gov.in/schemes/mpngigs,"The scheme aims to support non-government cultural institutions by providing financial grants for cultural activities, training, equipment, and events.","Financial Assistance, Non-government Institution, Cultural, Art, Literature"
Maintenance Grant to Institutions and Organizations Engaged in Cultural Activities,https://www.myscheme.gov.in/schemes/mgioeca,"The ""Maintenance Grant to Institutions and Organizations Engaged in Cultural Activities"" scheme was launched by the Arts and Culture Department, Puducherry. The scheme aims to provide a maintenance grant to the organizations engaged in cultural activities.","Financial Assistance, Maintenance Grant, Organization"
Marathi Drama Competition ‘A' & ‘B' Group,https://www.myscheme.gov.in/schemes/mdcabg,"The scheme ""Marathi Drama Competition 'A' & 'B' Group"" is a state-level initiative by the Kala Academy, under the Department of Art and Culture, Government of Goa. It provides a platform to urban and rural theatre groups and offers transport assistance for artistes and stage material as per govt.","Financial Assistance, Institutions, Prizes Awarded, Academy"
Marriage Assistance - Folk Artist,https://www.myscheme.gov.in/schemes/mafa,"The scheme ""Marriage Assistance"" was launched by the Art and Culture Department, Government of Tamil Nadu. This scheme provides financial assistance for the marriage of registered folk artists, or their son or daughter. The assistance aims to support the cultural community by helping with marriage.","Financial Assistance, Marriage, Folk Artist"
Meghalaya Sports & Wellness Centre Scheme,https://www.myscheme.gov.in/schemes/mswcs,The objective of the scheme is to improve the health and well-being of the local population. It promotes physical fitness and encourages participation in sports and wellness activities.,"Sports, Fitness, Mental Health, Exercise"
Preservation of Tiatr Literature,https://www.myscheme.gov.in/schemes/potl,"The scheme aims to encourage research work in the field of Tiatr and facilitate writers to take up research work in different aspects of Tiatr, its Song & Music. Research work will be published in book form with remuneration provided to researchers.","Literature, Documentation, Song, Academia, Music"
National Service Scheme,https://www.myscheme.gov.in/schemes/nssc,"The objective of the National Service Scheme (NSS) is to develop the personality and character of students through voluntary community service. The scheme aims to promote social responsibility, leadership, national integration, and a spirit of selfless service among youth.","National, Sports, Student, Youth, Education"
National Handicrafts Development Programme: Direct Benefit to Artisans - Supports to Artisans in Indigent Circumstances,https://www.myscheme.gov.in/schemes/nhdp-dba-saic,"The scheme ""Direct Benefit to Artisans - Supports to Artisans in Indigent Circumstances"" is designed to give a boost to the handicraft sector in India. Assistance of upto ₹8,000/- per month is granted to the Artisans in Indigent Circumstances in the form of monthly allowance/lump sum grant/ both.","Pension, Artisan, Handicraft, Senior Citizen, Financial Assistance, Social Welfare"
National Handicrafts Development Programme: Research & Development Scheme,https://www.myscheme.gov.in/schemes/nhdp-randds,"The ""NHDP: Research & Development Scheme"" is introduced to generate feedback on economic, social, aesthetic, and promotional aspects of various crafts and artisans in the handicraft sector. The surveys and studies are sponsored/conducted to generate suitable inputs for planning purposes.","Handicraft, Textile, Research, Grant-in-Aid"
Natural Death and Funeral Assistance,https://www.myscheme.gov.in/schemes/ndafa,"The Art and Culture Department, Government of Tamil Nadu was launched the scheme ""Natural Death and Funeral Assistance"". This scheme provides financial assistance for the funeral and natural death of registered folk artistes to support their families during difficult times.","Death, Artist, Funeral, Financial Assistance"
Poompuhar District Craft Award,https://www.myscheme.gov.in/schemes/pdca,"""Poompuhar District Craft Award"" was launched in 2011-2012 by the Dept of Handlooms, Handicrafts, Textiles & Khadi, Tamil Nadu. The award was introduced to recognize and honour the artisans district-wise. This award consists of a cash prize of ₹10,000/-, a silver medal, and a certificate.","Prize, Financial Assistance, Financial Assistance, Craft, Craft"
Poompuhar State Award,https://www.myscheme.gov.in/schemes/psa,"""Poompuhar State Award"" was launched by the Dept of Handlooms, Handicrafts, Textiles & Khadi, Tamil Nadu. The awardees are given ₹50,000, a 4-gram gold medal, tamirapathiram and a certificate. The economically backward awardees are also eligible for monthly pension of ₹3,500/- after 60 years of age.","Financial Assistance, Artisans, Award, Crafts"
Popular Tiatr Competition,https://www.myscheme.gov.in/schemes/ptc-g,The scheme aims to bring about all round development of Popular Tiatr through annual competitions. It provides cash prizes and awards to tiatr groups and individual artists performing in traditional tiatr format across Goa.,"Artist, Culture, Competition, Award, Acting, Singing"
Operation of Sports Hostels,https://www.myscheme.gov.in/schemes/osh,"The scheme aims to encourage tribal students to participate in sports and prepare them for national & international competitions. Tribal students from Classes 6 to 12 are provided with free accommodation, specialized training, nutritious meals & other necessary facilities in the sports hostels.","Hostel, Scheduled Tribe, Sports Training, Sports, Tribal Students"
Oral Documentation of History of Tiatr,https://www.myscheme.gov.in/schemes/odht,The scheme aims to preserve the oral history of tiatr for future generations through documentation of veteran artistes' experiences. It provides video recording and remuneration to eligible veteran tiatr artistes.,"Artist, Culture, Tiatr, Heritage, Remuneration"
Organisation of Cultural Programs,https://www.myscheme.gov.in/schemes/ocpr,"The scheme aims to provide financial assistance to cultural groups and artists registered with the Department for performing in cultural programs organized during traditional fairs, festivals, regional celebrations within and outside the state, as well as on the occasion of national festivals.","Cultural Programs, Artists, Cultural Groups, Culture"
Organising Sports Competitions and Training Camps,https://www.myscheme.gov.in/schemes/kpepska,"The scheme aims to promote sports at the grassroots levels by providing structured training, organizing competitions & nurturing sporting talent. Training is conducted through local camps in all districts for various sports, including football, athletics, boxing, volleyball, etc. with minimal fees.","Sports Competition, Training Camp, Sports, Sportsperson"
Organization of Sports Competitions and Training Programs,https://www.myscheme.gov.in/schemes/osctp,"The scheme aims to promote sports & identify grassroots-level talent among youth through structured competitions & training. Players are provided with cash prizes and free training, & participation is encouraged at multiple levels, including Gram Panchayat, Development Block, District, and State.","Cash Prizes, Sportsperson, Sports Competition, Training Program, Free Training, Sports"
Orientation Courses in Dramatics,https://www.myscheme.gov.in/schemes/ocd,"The ""Orientation Courses in Dramatics"" scheme by the Tiatr Academy of Goa aims to improve the quality of tiatr performances. It offers preliminary training and workshops in various aspects of dramatics, such as script writing and acting, to individuals and existing tiatr artistes.","Orientation, Education, Student, Workshop, Stage, Music"
Out of Turn Employment to Sportspersons in State Services,https://www.myscheme.gov.in/schemes/otejtpss,"The scheme aims to provide job opportunities to medal-winning sportspersons of Uttarakhand, who have represented the state in international and national games, by offering them out-of-turn employment in various state services.","Employment, Sports Quota Jobs, Athletes, Jobs, Sportspersons, Sports"
Padma Awards,https://www.myscheme.gov.in/schemes/pa,The scheme aims to recognize distinguished and exceptional achievements across various fields of public service and national importance.,"Award, Public Service, Art, Social Work, Civil Service"
Remembering Tiatr Artistes of Yesteryears - Organisation of Special Dedicated Programmes,https://www.myscheme.gov.in/schemes/rtay-osdp,The scheme aims to make younger generation aware of the contribution and sacrifices of great tiatr personalities of the past. It provides collaboration and financial assistance to produce special dedicated programmes on late artistes.,"Artist, Culture, Program, Show, Auditorium"
Retired Sportsperson Pension Scheme,https://www.myscheme.gov.in/schemes/rsps,"The scheme ""Retired Sportsperson Pension Scheme"" by the Sports, Youth and Cultural Activities Department, Government of Gujarat aims to ensure financial security to retired state-level medal-winning sportspersons aged above 50 years through monthly pension assistance.","Sport, Retired Sportsperson, Pension, Athletes"
Rock Climbing Adventure Training Course,https://www.myscheme.gov.in/schemes/rcatc,"The scheme aims to promote physical fitness, adventure awareness, and confidence-building among children through a 6-day rock climbing adventure course for 100 children aged 9 to 12 years, organized at Mount Abu/ Junagadh Center.","Adventure Sports, Rock Climbing, Training, Scheduled Tribes, Outdoor Activities, Children Development"
Rural Sports and Health Promotion Scheme,https://www.myscheme.gov.in/schemes/rsahps,"The scheme promotes fitness among rural youth by providing financial assistance to the mangal dals for setting up open gyms in each Gram Panchayat. Financial assistance of ₹17,960/- is allocated per gram panchayat for installing open gym/community fitness equipment to encourage fitness & well-being.","Rural Sports, Health Promotion, Sports Promotion, Youth, Mangal Dal, Open Gym"
Production of Audio Albums of songs on Patriotism & National Integration,https://www.myscheme.gov.in/schemes/paaspni,The scheme aims to strengthen values of Patriotism & National Integration among Tiatr fraternity by promoting production of Konkani audio albums. It provides financial support for producing albums with at least 10 patriotic songs for distribution to educational institutions.,"Culture, Artist, Album, Song, Music"
Production of Tiatr in Villages/Urban Areas/Educational Institutions,https://www.myscheme.gov.in/schemes/ptvuaei,The scheme aims to explore and develop hidden singing and acting talents among youths in villages by promoting tiatr activities. It provides financial and technical support to produce tiatr in original format for local communities.,"Artist, Culture, Program, Village, Singing, Acting"
Promotion of Duets/Duos/Trios/Quartets/Quintets/Choral Songs,https://www.myscheme.gov.in/schemes/pddtqqcs,The scheme aims to preserve the traditional concept of singing of duets/duos/trios/quartets/quintets/choral songs which has been on the decline. It provides cash prizes and certificates to singers participating in various traditional singing categories.,"Singer, Competition, Artist, Culture, Music, Tradition"
Promotion of Acting in Tiatr for School Children,https://www.myscheme.gov.in/schemes/patsc,The scheme aims to encourage school children to improve their acting abilities in Goan tiatr through organized competitions. It provides cash prizes and certificates to winners in comedy and non-comedy acting categories.,"Acting, School, Children, Artist, Culture, Comedy"
Promotion of Konkani Songs with Choreography & Dancing,https://www.myscheme.gov.in/schemes/pkscd,"The scheme aims to promote Konkani songs by presenting them with choreography and dancing to attract youth towards Konkani cultural performances. It provides cash prizes, mementos, certificates and traveling allowances to participating groups in organized competitions.","Artist, Youth, Choreography, Dance, Culture, Competition"
Promotion of Literature on Art & Culture of Local Authors/ Organization,https://www.myscheme.gov.in/schemes/placlao,"The scheme ""Goa State Best Library and Best Librarian Award"" has been designed to encourage Goan writers to publish their literature on Art and Culture. The entire expenditure on printing and publishing the book is borne by Govt. by keeping the copyright of the publication.","Culture, Author, Book, Publisher, Literature"
Promotion of Tiatr Music,https://www.myscheme.gov.in/schemes/potm,"The scheme aims to encourage individuals to learn blowing instruments crucial for Tiatr music, such as Trumpet & Saxophone, addressing a decline in musicians. It provides financial assistance for tuition and instrument purchase, benefiting youth and other interested persons to preserve Tiatr music.","Music, Training, Subsidy, Artist, Culture"
Promotion of Patriotism/National Integration/Communal Harmony - Interschool Choreographic Dance Competition,https://www.myscheme.gov.in/schemes/ppnich-icdc,"The scheme aims to inculcate values of patriotism, national integration, and communal harmony in children through choreographic dance competitions. Educational institutions can participate with dance groups performing on Konkani patriotic songs to win monetary prizes and recognition.","School, Dance, Competition, Artist, Culture"
Promotion of Patriotism/National Integration/Communal Harmony - Production of Musical Programme or Tiatr,https://www.myscheme.gov.in/schemes/ppnich-pmpt,"The scheme aims to project patriotism, nationalism, and communal harmony through tiatrs, songs and music. It provides remuneration and venue cost coverage to individuals, organizations, educational institutions and clubs.","Song, Music, Program, Artist, Culture"
Promotion of Tiatr Related Activities,https://www.myscheme.gov.in/schemes/ptra,"The scheme aims to support institutions and individuals to organize tiatr-related cultural activities in Goa. It provides financial assistance for Konkani musical shows, competitions, and programs celebrating tiatr artists.","Culture, Artist, Music, Competition, Heritage"
Promotion of Tribal Culture,https://www.myscheme.gov.in/schemes/ptc,"The scheme provides financial grants (up to ₹3,00,000/- per organization) to registered NGOs/Trusts/Voluntary Organizations for promoting tribal culture among ST(P) communities in Assam's plain districts (outside BTC).","Culture, Heritage, Tribal, Literature, NGO"
Promotion of Tiatr Through Academic Activities,https://www.myscheme.gov.in/schemes/pttaa,"The scheme aims to foster interest in Tiatr among students and enthusiasts through academic activities like talks, symposia, seminars, and workshops. It covers activity expenditures, honorarium for resource persons, and provides materials, benefiting educational institutions and individuals.","Student, Academic, Workshop, Culture, Awareness, Seminar, Grant"
Provision of Sports Kits to Players Participating at the National Level,https://www.myscheme.gov.in/schemes/pskppnl,"This scheme provides a sports kit worth ₹5000/- (including tracksuit, jersey, shorts, socks, etc.) to approximately 1000 players annually who participate in various sports at the national level, selected through their respective sports federations.","Sports Kit, National Level Participation, Athlete, Sports"
Publication Support Scheme for Fine Arts,https://www.myscheme.gov.in/schemes/pssffa,"The scheme ""Publication Support Scheme for Fine Arts"" by the Sports, Youth and Cultural Activities Department, Government of Gujarat, aims to encourage the publication of fine arts books through financial assistance provided to artists and art institutions.","Fine Arts, Book Publication, Artist Grant, Art Institutions"
Raising the Standard of Tiatr,https://www.myscheme.gov.in/schemes/rtsot,"The scheme aims to improve the quality and standard of Tiatr, the popular dramatic form of Goa. It benefits actors, directors, script writers, and backstage artists by reimbursing ticket costs for witnessing high-standard dramas to enhance performance quality.","Artist, Stage, Performance, Training, Culture, Reimbursement"
Rashtriya Khel Protsahan Puraskar,https://www.myscheme.gov.in/schemes/rkpp,"This scheme was launched by the Dept. of Sports. There are four categories of awards:
(a)	Identification and nurturing of budding/young talent
(b)	Encouragement to sports through Corporate Social Responsibility
(c)	Employment of sports persons and sports welfare measures
(d)	Sports for Development","Sports, Award"
Mukhyamantri Udeeyman Khiladi Unnayan Chhatravriti Yojana,https://www.myscheme.gov.in/schemes/mukuy,"The scheme aims to promote sports among talented children aged 8 to 14 years in Uttarakhand by providing a monthly scholarship of ₹1,500. Players in this age group are selected every year on the basis of Physical & Sports Aptitude Test (P-SAT), with 150 boys & 150 girls selected from each district.","Sportsperson, Scholarship, Sports, Player"
Pandit Deendayal Upadhyay National Welfare Fund For Sportspersons,https://www.myscheme.gov.in/schemes/pdunwfs,"The scheme of PDUNWFS is being implemented with the objective of providing financial assistance to outstanding sportspersons/family members living in indigent circumstances for various purposes like ameliorate condition, medical treatment, injuries, procurement of sports equipment etc.","Sportsperson, Welfare, Social Empowerment, Medical Treatment, Financial Assistance"
Pandit Omkarnath Classical Music Festival and Awards,https://www.myscheme.gov.in/schemes/pocmfa,"The scheme ""Pandit Omkarnath Classical Music Festival and Awards"" by the Sports, Youth and Cultural Activities Department, Government of Gujarat aims to honor and encourage contributions in classical music through national-level awards and recognition to eminent male classical music artists.","Classical Music Recognition, Indian Music Awards, Cultural Award"
